No.,도메인,세부 도메인,의도 (Intention),문장
753,차량 제어,운전 제어,일자 추월,차선 이동해서 앞지르기해 줘.
754,차량 제어,도어 제어,전체 차문 열기,세차하게 전체 차 문 다 열어 줘.
755,차량 제어,긴급 차량,에스오에스차량 양보,구급차의 앞 길을 막지 말자.
756,주행 정보,자율 주행 가능 여부,자율 주행 가능 여부 확인,자율 주행 모드가 이용 가능한지를 알아야겠어.
757,주행 정보,자율 주행 가능 여부,자율 주행 가능 여부 확인,자율 주행해도 될지 확인 가능해?
758,주행 정보,자율 주행 가능 여부,자율 주행 가능 여부 확인,자율 주행으로 가려는데 길 상태 양호하니?
759,주행 정보,주행 기록,자율 주행 주행 기록,어제까지 자율 운행으로 달린 총 소요 거리 알려 줘.
760,차선 제어,갓길 이동 정차,갓길 이동 명령,십 분 동안 갓길로 운전 부탁해.
761,차량 제어,운전 제어,일자 따라 가기,앞에 있는 차 뒤쫓아.
762,차량 제어,긴급 차량,에스오에스차량 양보,경찰차 진로 방해 안 하도록 해.
763,차량 제어,창문 제어,시동석 창문 열기,바람 좀 느끼게 시동석 창문 내려 줘.
764,차량 제어,도어 제어,전체 차문 열기,내리고 트렁크에서 짐 꺼내게 전체 차 문 다 열어.
765,차량 제어,속도 제어,주행 속도 세팅,육십으로 주행 속도 설정.
766,차량 제어,좌석 제어,좌석 통풍 끄기,지금 바로 시트 바람 좀 꺼 줄래?
767,차량 제어,긴급 차량,에스오에스차량 양보,경찰차 먼저 지나가게 옆 차선으로 이동해.
768,차량 제어,좌석 제어,좌석 통풍 켜기,전 자리 통풍 옵션 켜 줘.
769,차량 제어,운전 제어,일자 따라 가기,다른 거 필요 없이 앞 차만 따라 가.
770,차량 제어,창문 제어,전체 창문 닫기,전 창문 다 닫아 줘.
771,비상 제어,보험사 연락,자동 보험사 연락,이거 어떻게 해야 하는지 보험회사한테 자동으로 전화 좀 해 줄래?
772,차량 제어,창문 제어,조수석 창문 닫기,조수석 윈도만 클로즈 해 줄래?
773,차선 제어,갓길 이동 정차,갓길 이동 명령,지금으로부터 두 번째로 나타나는 갓길에 차 정차해 줘.
774,차량 제어,공조 제어,히터 제어,히터 풍향 위로 해 줘.
775,차량 제어,도어 제어,뒷자리 차문 열기,뒷자리 차문 이제 열어.
776,차량 제어,좌석 제어,좌석 통풍 켜기,좌석 통풍 기능 좀 이용해야 할 것 같아.
777,차선 제어,차선 변경,차선 변경,차선 옆으로 옮기자.
778,차량 제어,운전 제어,일자 추월,앞에 초록색 차보다 무조건 빨리 달려.
779,차량 제어,좌석 제어,좌석 온도 제어,등에 땀나니까 의자 난방 꺼도 돼.
780,차량 제어,공조 제어,에어컨 제어,에어컨 약 냉방으로 가동해 줘.
781,차량 제어,창문 제어,조수석 창문 열기,조수석 창문 닫혀있으면 열어 줘.
782,차량 제어,좌석 제어,좌석 통풍 켜기,좌석마다 통풍 기능 작동해 줘.
783,주행 정보,주행 기록,자율 주행 주행 기록,제일 최근에 어디서 자율 주행했었는지 알려 줘.
784,차량 제어,창문 제어,조수석 창문 열기,도착하면 조수석 창문 조금만 내려놔.
785,차량 제어,도어 제어,조수석 차문 열기,조수석 차 문 열었어?
786,주행 정보,자율 주행 가능 여부,자율 주행 가능 여부 확인,자율 주행 모드 실시 가능한지 봐 줘.
787,차량 제어,운전 제어,일자 추월,앞 차 추월에 실패하면 바뀐 차선에서 원래대로 주행해.
788,비상 제어,보험사 연락,자동 보험사 연락,보험회사와 자동 연결 온 해 줘.
789,차량 제어,속도 제어,주행 속도 세팅,팔십 킬로미터 넘지 말도록.
790,차량 제어,긴급 차량,에스오에스차량 양보,구급차 진로 양보해 줘.
791,차선 제어,갓길 이동 정차,갓길 이동 명령,지금 빨리 오른쪽 갓길 차선으로 이동해 줘.
792,차량 제어,속도 제어,주행 속도 세팅,속도 육십을 초과하지 말아 줘.
793,차량 제어,공조 제어,에어컨 제어,아직 더워 에어컨 온도 좀 더 내려 줘.
794,주행 정보,속도 확인,자율 주행 속도 확인,자율 주행 지금 속도가 뭐야?
795,차선 제어,갓길 이동 정차,갓길 이동 명령,근처 갓길로 가 줘.
796,주행 정보,주행 기록,자율 주행 주행 기록,저번 주 자율 주행 기록 요약해서 알려 줘.
797,차량 제어,좌석 제어,좌석 통풍 켜기,밖에서 너무 땀 흘리고 들어왔는데 좌석 통풍 켜 줘.
798,차량 제어,긴급 차량,에스오에스차량 양보,구급차 보내.
799,비상 제어,보험사 연락,자동 보험사 연락,자동으로 보험사에 연락 닿게 해 줄래?
800,차량 제어,자율 주행 시작,자율 주행 모드 시작,이제부터 자율 운행해 줘.
801,차량 제어,긴급 차량,에스오에스차량 양보,양보해서 구급차 뒤로 가.
802,차량 제어,긴급 차량,에스오에스차량 양보,앰뷸런스 먼저 보내자.
803,차량 제어,좌석 제어,좌석 통풍 끄기,의자에서 나오는 바람 꺼.
804,차량 제어,도어 제어,뒷자리 차문 열기,뒷자리 차 문 빼고 잠금 풀어 줘.
805,차량 제어,속도 제어,주행 속도 세팅,평균 시속 육십킬로미터로 목적지까지 운전해 줘.
806,주행 정보,속도 확인,자율 주행 속도 확인,자율 주행 속도 확인 필요해.
807,차량 제어,공조 제어,에어컨 제어,에어컨 온도 너무 낮은데 올려 줘.
808,차량 제어,속도 제어,주행 속도 세팅,운전 속도 평균 육십킬로미터로 달릴게.
809,주행 정보,주행 기록,자율 주행 주행 기록,자율 주행 주행 기록 필요해.
810,차선 제어,차선 유지,차선 유지 모드 켜기,차선 유지 모드로 전환시켜 줘.
811,차량 제어,공조 제어,히터 제어,히터 온도 빵빵하게 올려 줘.
812,차선 제어,차선 변경,왼쪽으로 차선 변경,우리 차 왼쪽 차선으로 가야 해.
813,차선 제어,차선 유지,차선 유지 모드 켜기,차선 유지 모드 시작으로 수정해 줘.
814,차량 제어,좌석 제어,좌석 온도 올리기,운전석 시트 뜨거운 상태로 만들어 줘.
815,차량 제어,창문 제어,전체 창문 열기,실내 공기 탁할 때 모든 창문 다 열어 줘.
816,비상 제어,차량 비상 정지,비상 정지 모드 켜기,비상 정지 모드 켜두고 싶어.
817,차량 제어,운전 제어,일자 추월,앞에 있는 차 추월 시작.
818,비상 제어,차량 비상 정지,비상 정지 모드 끄기,도로가 텅 비었네. 비상 정지 모드 끄고 가자.
819,주행 정보,속도 확인,자율 주행 속도 확인,자율 주행 속도 몇으로 설정되어 있어?
820,비상 제어,차량 비상 정지,비상 정지 모드 켜기,비상 정지 모드 쓸 게.
821,차량 제어,창문 제어,조수석 창문 열기,조수석 창문 열어젖혀.
822,차선 제어,차선 변경,왼쪽으로 차선 변경,차도 너무 막히니까 왼쪽으로 차선 변경해 줘.
823,비상 제어,보험사 연락,자동 보험사 연락,자동으로 보험회사랑 접촉해야 해.
824,차량 제어,도어 제어,조수석 차문 열기,조수석 차 문 열어야 해.
825,차량 제어,도어 제어,조수석 차문 열기,조수석에 앉은 사람 나가기 쉽게 문 열어 줘.
826,주행 정보,속도 확인,자율 주행 속도 확인,몇 킬로미터로 달리고 있는지 자율 주행 속도 알려 줘.
827,비상 제어,차량 비상 정지,비상 정지 모드 켜기,브레이크를 밟고 있는 상태에서도 비상 정지가 가능하도록 해 줘.
828,차량 제어,창문 제어,전체 창문 닫기,모든 창문 다 끝까지 닫아 줘.
829,차량 제어,운전 제어,일자 추월,앞 차를 지나쳐 가.
830,주행 정보,속도 확인,자율 주행 속도 확인,자율 주행 시속이 얼마인지 브리핑해.
831,차량 제어,창문 제어,전체 창문 닫기,오분 뒤에 열린 창문 다 닫아 줘.
832,차량 제어,운전 제어,일자 추월,앞에 차 지금 바로 추월하도록 해.
833,차량 제어,좌석 제어,좌석 통풍 켜기,좌석 통풍 켜 보자.
834,차량 제어,창문 제어,전체 창문 닫기,전체 창문 닫아 볼까?
835,차량 제어,속도 제어,주행 속도 세팅,주행 속도 빠르게 부탁해.
836,차량 제어,좌석 제어,좌석 온도 내리기,시트 온도 이십육 도까지 내려 줄래?
837,비상 제어,보험사 연락,자동 보험사 연락,보험회사에 저절로 연락이 닿도록 설정해 놔.
838,비상 제어,차량 비상 정지,비상 정지 모드 끄기,비상 정지 모드 안 켜도 될 거 같아.
839,차선 제어,차선 변경,왼쪽으로 차선 변경,차 안 올 때 왼쪽 차선으로 바꿔 줘.
840,차량 제어,공조 제어,에어컨 제어,에어컨 파워 올려 줘.
841,차선 제어,차선 유지,차선 유지 모드 켜기,현재 차선 계속 타고 가.
842,차량 제어,운전 제어,일자 따라 가기,앞 차랑 가는 길이 똑같네 붙어서 가 줘.
843,차량 제어,좌석 제어,좌석 온도 제어,의자 시트에 열선 작동시켜 줘.
844,주행 정보,주행 기록,자율 주행 주행 기록,작년에 가장 길게 자율 주행한 코스가 어떻게 돼?
845,주행 정보,자율 주행 가능 여부,자율 주행 가능 여부 확인,자율 주행 언제쯤 가능한지 알려 줘.
846,차선 제어,차선 유지,차선 유지 모드 켜기,차선 유지 모드 실시해 줘.
847,차량 제어,좌석 제어,좌석 통풍 켜기,시트 통풍 작동시켜 줘.
848,차량 제어,창문 제어,전체 창문 열기,이 터널 지나면 창문 다 열어 줘.
849,비상 제어,보험사 연락,자동 보험사 연락,보험사에 전화연결 자동으로 부탁할게.
850,차량 제어,긴급 차량,에스오에스차량 양보,구급차 먼저 보내야 될 것 같은데?
851,차선 제어,차선 변경,왼쪽으로 차선 변경,차 안 막히는 왼쪽 차선으로 가.
852,차량 제어,운전 제어,일자 따라 가기,지금 보이는 앞 차 따라 운행 해.
853,주행 정보,주행 기록,자율 주행 주행 기록,자율 주행 거리 현재 얼마나 되니?
854,차량 제어,좌석 제어,좌석 온도 올리기,운전석과 조수석만 시트 따뜻하게.
855,주행 정보,주행 기록,자율 주행 주행 기록,여태까지 자율 주행한 기록 확인해.
856,주행 정보,자율 주행 가능 여부,자율 주행 가능 여부 확인,도로 상황 고려해서 현재 자율 주행 모드를 사용할 수 있을지 판단해.
857,차량 제어,좌석 제어,좌석 온도 내리기,너무 뜨거우니까 좌석 온도 낮 춰.
858,차량 제어,좌석 제어,좌석 통풍 끄기,의자 바람 나오는 거 이제 꺼도 돼.
859,차량 제어,도어 제어,뒷자리 차문 닫기,뒷자리 차문은 닫자.
860,차량 제어,창문 제어,조수석 창문 닫기,바깥공기가 너무 안 좋아 조수석 창문 닫아 줘.
861,차량 제어,자율 주행 시작,자율 주행 모드 시작,자율 주행 모드 선택해 줘.
862,차선 제어,차선 변경,왼쪽으로 차선 변경,뒤 차 양보하게 왼쪽 차선으로 변경해서 가.
863,주행 정보,주행 기록,자율 주행 주행 기록,자율 주행 최장 기록 보여 줘.
864,비상 제어,보험사 연락,자동 보험사 연락,보험사 측 사람이랑 자동으로 연결해 줘.
865,차량 제어,운전 제어,일자 추월,앞 차 상대로 우리가 더 앞으로 가자.
866,차량 제어,도어 제어,조수석 차문 열기,조수석에 누가 탈거야 문 열어 줘.
867,비상 제어,차량 비상 정지,비상 정지 모드 켜기,지금 비상 정지 모드 시작으로 전환할게.
868,차량 제어,좌석 제어,좌석 온도 올리기,시트 온도 올라 가게 해 줘.
869,주행 정보,주행 기록,자율 주행 주행 기록,일주일에 평균 얼마나 자율 주행을 사용했어?
870,차량 제어,운전 제어,일자 추월,정차 따라잡고 싶으니깐 최대한 붙어.
871,차량 제어,자율 주행 시작,자율 주행 모드 시작,자율 주행 모드 켬.
872,주행 정보,주행 기록,자율 주행 주행 기록,여태 얼마나 달렸는지 계산해서 알려 줘.
873,차량 제어,운전 제어,일자 따라 가기,앞에 차 놓치지 말고 잘 봐.
874,차선 제어,갓길 이동 정차,갓길 이동 명령,잠깐 갓길로 차량 세워 봐.
875,차량 제어,운전 제어,일자 추월,앞 차 좀 앞질러 줄래?
876,차량 제어,도어 제어,전체 차문 닫기,네가 차 문 좀 다 닫아 줘.
877,차선 제어,차선 유지,차선 유지 모드 켜기,차선 쭉 일정하게 해 줘.
878,차량 제어,좌석 제어,좌석 통풍 켜기,운전할 때 운전석 시트 통풍 실행해 줘.
879,비상 제어,보험사 연락,자동 보험사 연락,에어백이 터지면 보험사에 연락해 줘.
880,차량 제어,도어 제어,뒷자리 차문 닫기,다시 열라고 할 때까지 못 열게 해.
881,차량 제어,도어 제어,전체 차문 닫기,다 탔으니까 차 문 닫아 줘.
882,차량 제어,자율 주행 시작,자율 주행 모드 시작,나는 자율 주행 모드를 사용하고 싶어.
883,차량 제어,운전 제어,일자 따라 가기,앞 차 속도대로 운전하면 되겠다.
884,차량 제어,좌석 제어,좌석 통풍 켜기,시트 통풍으로 땀 없애 줘.
885,차량 제어,공조 제어,에어컨 제어,에어컨 터보로 전환해 줘.
886,주행 정보,속도 확인,자율 주행 속도 확인,자율 주행 시속이 육십 킬로미터인지 확인해 봐.
887,차량 제어,좌석 제어,좌석 통풍 끄기,너무 추워서 시트 통풍 좀만 낮춰 줘.
888,차량 제어,운전 제어,일자 따라 가기,앞 차 뒤에서 계속 따라 가 줘.
889,비상 제어,보험사 연락,자동 보험사 연락,보험사 콜 자동으로 연결해 줘.
890,차선 제어,차선 변경,왼쪽으로 차선 변경,차선 왼쪽으로 가 주겠니?
891,차량 제어,공조 제어,히터 제어,히터 바람 방향 위 아래로 반복해 줘.
892,주행 정보,주행 기록,자율 주행 주행 기록,주행 기록 체크해야겠어.
893,차량 제어,좌석 제어,좌석 온도 올리기,차 안의 모든 시트 따뜻하게 해 줘.
894,비상 제어,차량 비상 정지,비상 정지 모드 켜기,비상 정지 모드 온 해 줄래?
895,주행 정보,주행 기록,자율 주행 주행 기록,자율 주행 주행 기록 브리핑 해 줘.
896,차량 제어,운전 제어,일자 추월,빨리 가야 돼 맨 앞으로 가 줘.
897,차량 제어,도어 제어,조수석 차문 열기,도착하면 조수석 차문부터 열어 줘.
898,비상 제어,차량 비상 정지,비상 정지 모드 켜기,사고 확인을 위해 비상 정지 모드 켜.
899,차량 제어,운전 제어,일자 추월,앞 차 좀 역전해 줄래?
900,차선 제어,차선 변경,차선 변경,이따 우회전할 거니까 미리 차선 변경해 놔.
901,차량 제어,공조 제어,히터 제어,히터 바람 아주 약하게 설정해서 틀어 줘.
902,차량 제어,공조 제어,히터 제어,히터 온도 좀 높이라니까!
903,주행 정보,주행 기록,자율 주행 주행 기록,이번 주 자율 주행 기록 볼래.
904,주행 정보,속도 확인,자율 주행 속도 확인,지금 시속 몇 킬로미터로 자율 주행 중이지?
905,차량 제어,좌석 제어,좌석 통풍 켜기,시트 통풍으로 등 식혀 줘.
906,주행 정보,주행 기록,자율 주행 주행 기록,자율 주행 걸린 시간 얼마예요?
907,차량 제어,도어 제어,조수석 차문 열기,조수석 도어 잠금 해제할래.
908,차량 제어,좌석 제어,좌석 통풍 켜기,좌석 통풍 기능을 써야 해.
909,차량 제어,긴급 차량,에스오에스차량 양보,경찰차 빨리 갈 수 있게 왼쪽으로 비켜 줄래?
910,차량 제어,속도 제어,주행 속도 세팅,한 번 더 주행 속도 오 킬로미터 늘려 줘.
911,차량 제어,도어 제어,조수석 차문 열기,조수석 차 문 만 자동으로 열리면 될 것 같아.
912,차량 제어,공조 제어,에어컨 켜기,에어컨 켜도 괜찮아.
913,차선 제어,차선 유지,차선 유지 모드 켜기,차선 유지 모드 작동해 주시겠어요?
914,차량 제어,긴급 차량,에스오에스차량 양보,뒤에 오는 구급차가 지나갈 수 있게 길 만들어 줘.
915,차량 제어,창문 제어,시동석 창문 열기,시동석 창 열고 가자.
916,차량 제어,도어 제어,조수석 차문 열기,조수석 쪽 문 열어 줘.
917,주행 정보,주행 기록,자율 주행 주행 기록,자율 주행 시작 시점 알려 줘.
918,차선 제어,갓길 이동 정차,갓길 이동 명령,갓길에 차 댈 만한 곳 찾아봐.
919,차량 제어,도어 제어,뒷자리 차문 열기,뒷자리 문 잠금장치 해제.
920,차량 제어,운전 제어,일자 따라 가기,앞 차들 따라서 천천히 따라 가 줘.
921,차량 제어,도어 제어,조수석 차문 닫기,조수석 문 안 열리게 잠가.
922,차선 제어,차선 변경,오른쪽으로 차선 변경,이 신호 지나서 우회전할 거라서 오른쪽 차선으로 변경.
923,차량 제어,도어 제어,조수석 차문 닫기,추워 조수석 차 문 닫아 줘.
924,차선 제어,차선 변경,왼쪽으로 차선 변경,좌측 차선에서 주행해야 할 것 같아.
925,차량 제어,도어 제어,뒷자리 차문 닫기,뒷자리 차 문은 주행 중에 안 열리게 잠가 줘.
926,차량 제어,공조 제어,히터 켜기,지금 빨리 히터 좀 켜 줘.
927,주행 정보,속도 확인,자율 주행 속도 확인,자율 운행 속도 몇으로 이동하고 있는 거야?
928,비상 제어,차량 비상 정지,비상 정지 모드 끄기,긴급 비상 정지 기능 취소.
929,차선 제어,갓길 이동 정차,갓길 이동 명령,갓길에 차 좀 세워봐.
930,차량 제어,운전 제어,일자 따라 가기,내 앞에 달리는 차량 뒤따라 가 줘.
931,비상 제어,보험사 연락,자동 보험사 연락,사고 나면 보험사 직원한테 가장 먼저 전화해 줘.
932,차선 제어,차선 변경,오른쪽으로 차선 변경,오른쪽 차선으로 가자.
933,차량 제어,운전 제어,일자 따라 가기,우리 저 앞 차 따라 가자.
934,차량 제어,공조 제어,히터 제어,히터 엄청 세게 해 줘.
935,차량 제어,도어 제어,조수석 차문 열기,조수석 차 문 열 수 있게 해 줘.
936,주행 정보,주행 기록,자율 주행 주행 기록,자율 주행했던 기록 표시.
937,차선 제어,갓길 이동 정차,갓길 이동 명령,화장실 급하다 갓길로 빠져.
938,차량 제어,좌석 제어,좌석 통풍 제어,좌석 통풍 가장 약하게 켜 줘.
939,주행 정보,주행 기록,자율 주행 주행 기록,주행 기록상 자율 주행 속도의 통계 자료를 확인하고 싶어.
940,차량 제어,도어 제어,전체 차문 열기,전체 문 다 닫아 주세요.
941,차량 제어,공조 제어,에어컨 제어,바람 속도 더 올려 줘.
942,차량 제어,좌석 제어,좌석 온도 내리기,좌석 온도가 너무 뜨거워 더 낮춰 줘.
943,차량 제어,공조 제어,히터 제어,히터 온도 가장 높게 해 줘.
944,차량 제어,좌석 제어,좌석 온도 제어,좌석 온도를 이십육 도로 할래.
945,차선 제어,갓길 이동 정차,갓길 이동 명령,갓길로 차량 유도 부탁해.
946,비상 제어,보험사 연락,자동 보험사 연락,보험회사 자동 연락 부탁할게.
947,차량 제어,좌석 제어,좌석 온도 내리기,더워서 좌석 온도 좀만 내려 줘.
948,차량 제어,좌석 제어,좌석 통풍 켜기,좌석 전체 통풍 잘 되게 만들어 줘.
949,차량 제어,자율 주행 시작,자율 주행 모드 시작,자율 주행 모드 스타트해 줘.
950,차량 제어,운전 제어,일자 따라 가기,앞 차랑 비슷하게 뒤따라 가.
951,주행 정보,자율 주행 가능 여부,자율 주행 가능 여부 확인,자율 주행할 수 있나 알려 주세요.
952,차량 제어,긴급 차량,에스오에스차량 양보,앞에 사고 났다던데 긴급 차량들 지나갈 수 있게 양보해 줘.
953,차량 제어,도어 제어,뒷자리 차문 열기,도착 시에만 뒷자리 차 문 잠금 풀어.
954,차량 제어,공조 제어,에어컨 끄기,에어컨 바람 기능 꺼.
955,차량 제어,도어 제어,조수석 차문 열기,친구 내리게 조수석 열어 줘.
956,차량 제어,공조 제어,에어컨 제어,에어컨 온도 제일 약하게 틀어.
957,주행 정보,자율 주행 가능 여부,자율 주행 가능 여부 확인,현재 자율 주행 모드가 사용 가능한 상태니?
958,주행 정보,자율 주행 가능 여부,자율 주행 가능 여부 확인,자율 주행으로 주행할래 가능해?
959,차량 제어,좌석 제어,좌석 온도 올리기,너무 추우니까 좌석 좀 따뜻하게 부탁해.
960,비상 제어,보험사 연락,자동 보험사 연락,자동으로 보험사와 콘택트 할 수 있게 만들어 줘.
961,비상 제어,차량 비상 정지,비상 정지 모드 끄기,나 차량 비상 정지 기능 끄고 싶어. 꺼 줘.
962,차량 제어,좌석 제어,좌석 온도 올리기,열선 시트 한 단계 높여 줘.
963,차량 제어,도어 제어,전체 차문 닫기,전체 도어 안 열리게 락 설정해.
964,차량 제어,운전 제어,일자 따라 가기,앞 차가 가는 대로 주행해 줘.
965,차선 제어,차선 변경,차선 변경,터널 빠져나가자마자 왼쪽으로 차선 변경해서 가자.
966,차선 제어,갓길 이동 정차,갓길 이동 명령,갓길이 보이니 잠시 운행 쉬도록 들어가 줘.
967,차량 제어,자율 주행 시작,자율 주행 모드 시작,이제 졸리니까 자율 주행 모드 켤래.
968,차량 제어,자율 주행 시작,자율 주행 모드 시작,자율 주행 모드 운전 종료.
969,비상 제어,보험사 연락,자동 보험사 연락,보험사 자동 연결 준비 해 놔.
970,비상 제어,차량 비상 정지,비상 정지 모드 끄기,비상 모드 없애고 주행하자.
971,차량 제어,자율 주행 시작,자율 주행 모드 종료,켜져 있는 자율 주행 꺼 줄래?
972,차량 제어,자율 주행 시작,자율 주행 모드 시작,자율 운행 온으로 실행해 줘.
973,차량 제어,긴급 차량,에스오에스차량 양보,경찰차 빠르게 갈 수 있게 비켜 줘.
974,주행 정보,주행 기록,자율 주행 주행 기록,자율 주행 출발 시각 들려 줘.
975,차량 제어,좌석 제어,좌석 통풍 켜기,좌석 전체에 통풍 기능 활성화 부탁 할게.
976,차선 제어,차선 유지,차선 유지 모드 켜기,차선 유지하면서 주행 부탁해.
977,차량 제어,운전 제어,일자 따라 가기,우리 앞에랑 같은 곳에 도착할 수 있게 해.
978,차선 제어,차선 변경,오른쪽으로 차선 변경,삼 분 뒤에 차선 오른쪽으로 교체해.
979,주행 정보,주행 기록,자율 주행 주행 기록,자율 주행 지금까지의 누적 기록 알려 줘.
980,주행 정보,주행 기록,자율 주행 주행 기록,자율 주행 속도가 가장 높았던 구간이 어딘지 알려 줘.
981,비상 제어,보험사 연락,자동 보험사 연락,자동으로 보험회사 연결 가능할까요?
982,차량 제어,긴급 차량,에스오에스차량 양보,길 터서 앰뷸런스 보내 줘.
983,차량 제어,공조 제어,히터 제어,앞 좌석 히터는 꺼 줘.
984,차량 제어,운전 제어,일자 따라 가기,앞 차 도착지까지 따라 가 줘.
985,차량 제어,운전 제어,일자 추월,시야 가리는 저 트럭 따라잡자!
986,차량 제어,창문 제어,전체 창문 닫기,창문을 하나도 남김없이 닫아 줄래?
987,차선 제어,차선 변경,오른쪽으로 차선 변경,오른쪽 세 차선을 변경해야 해.
988,비상 제어,차량 비상 정지,비상 정지 모드 끄기,비상 정지 기능 꺼 놔.
989,차량 제어,좌석 제어,좌석 통풍 켜기,좌석 통풍 들게 해 줘.
990,차량 제어,창문 제어,조수석 창문 열기,조수석 창문 끝까지 다 열어 줘.
991,주행 정보,주행 기록,자율 주행 주행 기록,내가 얼마나 자율 주행 기능을 사용했는지 알려 줘.
992,차량 제어,운전 제어,일자 따라 가기,앞 차 속도에 맞춰 가.
993,차선 제어,갓길 이동 정차,갓길 이동 명령,곧 나오는 갓길에 차 정차해 줘.
994,차량 제어,도어 제어,조수석 차문 열기,조수석 차 문 잠그지 마.
995,차량 제어,공조 제어,히터 제어,히터 온도 좀 더 높여야 할 거 같아.
996,차량 제어,창문 제어,전체 창문 열기,환기되도록 전체 창문 내리고 가 줘.
997,차량 제어,창문 제어,조수석 창문 열기,조수석 창문 열도록 부탁해.
998,주행 정보,주행 기록,자율 주행 주행 기록,자율 주행으로 운행한 거리 계산 부탁헤.
999,차량 제어,창문 제어,시동석 창문 열기,시동석 창문만 약간 열자.
1000,차량 제어,긴급 차량,에스오에스차량 양보,구급차 먼저 가게 살짝 비켜 줘.
1001,차량 제어,좌석 제어,좌석 온도 올리기,시트 온도 이 도 올려 줘.
1002,비상 제어,보험사 연락,자동 보험사 연락,사고 난 거 어떻게 해야 돼?
1003,차량 제어,도어 제어,전체 차문 열기,모든 문 잠시 열어 줘.
1004,차량 제어,운전 제어,일자 추월,지금 앞에 있는 차 지나쳐 줘.
1005,차량 제어,도어 제어,조수석 차문 닫기,조수석 문 열린거 닫아 줘.
