No.,도메인,세부 도메인,의도 (Intention),문장
1501,차량 제어,좌석 제어,좌석 통풍 끄기,시동석 통풍 기능 그만 쓸게.
1502,차량 제어,좌석 제어,좌석 통풍 제어,좌석에 통풍 기능 풀 가동해 줘.
1503,주행 정보,주행 기록,자율 주행 주행 기록,최근 자율 주행 기록을 나타내 줘.
1504,비상 제어,차량 비상 정지,비상 정지 모드 켜기,비상 정지 모드 실행 시작 해.
1505,차량 제어,속도 제어,주행 속도 세팅,주행 속도는 육십 킬로미터 넘지 마.
1506,차량 제어,운전 제어,일자 따라 가기,앞 차랑 안 부딪히게 따라 주행해 줘.
1507,차량 제어,자율 주행 시작,자율 주행 모드 시작,자율 주행으로 스타트 해 줘.
1508,차량 제어,좌석 제어,좌석 통풍 켜기,시트에 통풍 기능 실행 부탁해.
1509,비상 제어,보험사 연락,자동 보험사 연락,보험사에 자동으로 요청해 줘.
1510,차량 제어,공조 제어,에어컨 제어,더워 온도를 내려 주기 바래.
1511,차량 제어,도어 제어,조수석 차문 닫기,조수석에서 나갈 수 없게 차 문 잠 궈.
1512,비상 제어,차량 비상 정지,비상 정지 모드 켜기,비상 정지 시스템 작동 시켜 줘.
1513,차량 제어,긴급 차량,에스오에스차량 양보,에스오에스 차량이 오면 말 안 해도 양보해.
1514,차량 제어,좌석 제어,좌석 온도 올리기,시트 온도 조금 올려 줘.
1515,차량 제어,도어 제어,조수석 차문 열기,조수석 문 열어서 손님 태워 줘.
1516,차량 제어,운전 제어,일자 추월,시간 촉박하니까 앞에 차보다 빨리 가 줘.
1517,주행 정보,자율 주행 가능 여부,자율 주행 가능 여부 확인,자율 주행 수행 준비되었는지 알려 줘.
1518,주행 정보,자율 주행 가능 여부,자율 주행 가능 여부 확인,이 분 뒤에 자율 주행 가능한지 확인해 줘.
1519,차량 제어,긴급 차량,에스오에스차량 양보,구급차 막지 않게 비켜 줄래?
1520,차량 제어,창문 제어,조수석 창문 열기,조수석 창문 열림 버튼 눌러 줘.
1521,주행 정보,주행 기록,자율 주행 주행 기록,제 차의 자율 주행 기록을 부탁합니다.
1522,차량 제어,좌석 제어,좌석 온도 내리기,시트 온도 약하게 바꿔.
1523,차량 제어,긴급 차량,에스오에스차량 양보,긴급 차량 진입 확보해 줘.
1524,차량 제어,공조 제어,에어컨 제어,에어컨 각도 바꿔 줘.
1525,차선 제어,차선 변경,차선 변경,이 킬로미터 앞에서 일 차선으로 변경해 줘.
1526,비상 제어,보험사 연락,자동 보험사 연락,뒤에서 차를 박았는데 어떻게 해야 하는지 보험회사랑 전화 연결해 줘.
1527,차량 제어,속도 제어,주행 속도 세팅,이 도로의 평균 속도로 세팅하고 운전해 줄래?
1528,차량 제어,운전 제어,일자 추월,바쁘니까 최대한 추월하면서 가.
1529,차량 제어,공조 제어,히터 제어,바람 미풍으로 바꿔 줘.
1530,차량 제어,공조 제어,에어컨 제어,현재보다 에어컨 더 낮춰 줘.
1531,차량 제어,공조 제어,히터 제어,히터 바람 올려 줘.
1532,주행 정보,주행 기록,자율 주행 주행 기록,지금까지 자율 주행 이용 시간이 얼마나 돼?
1533,차량 제어,도어 제어,뒷자리 차문 열기,전방의 목적지에서 오른쪽 뒤의 차문을 열어 줘.
1534,차량 제어,자율 주행 시작,자율 주행 모드 종료,생각보다 자율 주행 모드가 불편하네 꺼 줘.
1535,비상 제어,보험사 연락,자동 보험사 연락,전화 연결해서 지금 상황 어떤지 설명해 줘.
1536,비상 제어,보험사 연락,자동 보험사 연락,현대보험의 전화번호로 자동 발신 해 줘.
1537,주행 정보,주행 기록,자율 주행 주행 기록,주행 기록에서 자율 운행으로 얼마나 이동했는지 확인해 줘.
1538,차량 제어,공조 제어,에어컨 제어,너무 덥다 파워 냉방으로 켜 줘.
1539,차량 제어,운전 제어,일자 추월,앞 차 건너뛰고 싶어.
1540,차선 제어,차선 변경,왼쪽으로 차선 변경,왼쪽 차선으로 가는 게 빨라 보여.
1541,차량 제어,창문 제어,전체 창문 열기,전체 창문 아래로 완전히 내려 줘.
1542,차선 제어,갓길 이동 정차,갓길 이동 명령,갓길 보이면 갓길로 가 줘.
1543,차량 제어,좌석 제어,좌석 온도 내리기,의자 온도 좀 내려 주겠니?
1544,차량 제어,좌석 제어,좌석 통풍 켜기,좌석 통풍 기능이 필요해.
1545,비상 제어,보험사 연락,자동 보험사 연락,보험 연락 바로 가능하게 해 줘.
1546,차량 제어,긴급 차량,에스오에스차량 양보,차 이동해서 구급차 진로 확보해.
1547,차선 제어,갓길 이동 정차,갓길 이동 명령,일단 갓길에서 좀 잘래.
1548,차량 제어,운전 제어,일자 따라 가기,앞 차 속도와 똑같이 주행해서 따라 가 줘.
1549,비상 제어,보험사 연락,자동 보험사 연락,내 차에 문제 있으면 자동으로 보험회사에 연락 해 줄래?
1550,차량 제어,좌석 제어,좌석 온도 올리기,좌석 온도 기능 최대치로.
1551,차선 제어,갓길 이동 정차,갓길 이동 명령,갓길에 차 세워야겠으니 좀 부탁 해.
1552,차량 제어,운전 제어,일자 따라 가기,앞 차 주행과 똑같이 주행해.
1553,비상 제어,보험사 연락,자동 보험사 연락,보험사랑 자동으로 연락 어떻게 해?
1554,차량 제어,좌석 제어,좌석 통풍 끄기,좌석이 너무 차가워 이제 꺼 줘.
1555,주행 정보,속도 확인,자율 주행 속도 확인,지금 자율 주행 시속 얼마큼 나와?
1556,차량 제어,공조 제어,에어컨 켜기,에어컨 전원 켜 줘.
1557,비상 제어,보험사 연락,자동 보험사 연락,보험회사랑 자동으로 연락 되는지 확인 해.
1558,차량 제어,좌석 제어,좌석 온도 제어,좌석 온도 이대로 유지해 줘.
1559,차량 제어,공조 제어,에어컨 제어,에어컨 온도 조금만 떨어뜨려.
1560,차량 제어,운전 제어,일자 추월,지금 앞의 차보다 빨리 갈 수 있어?
1561,주행 정보,속도 확인,자율 주행 속도 확인,자율 주행 속도 지금 말해 줄래?
1562,비상 제어,보험사 연락,자동 보험사 연락,깜빡할 수도 있으니 너가 보험사랑 연락이 닿게 도와 줘.
1563,차량 제어,공조 제어,에어컨 제어,너무 더워 에어컨 온도 내려 줘.
1564,주행 정보,자율 주행 가능 여부,자율 주행 가능 여부 확인,차 안에서 서류를 검토해야 하는데 자율 주행 가능해?
1565,차량 제어,좌석 제어,좌석 통풍 켜기,운전석 통풍 시트 돌려 줄래?
1566,주행 정보,주행 기록,자율 주행 주행 기록,최근에 자율 주행으로 어디 갔다 왔더라?
1567,비상 제어,보험사 연락,자동 보험사 연락,곧바로 보험사에 연락해 줘.
1568,차량 제어,운전 제어,일자 추월,앞 차 추월 도와 줘.
1569,주행 정보,속도 확인,자율 주행 속도 확인,자율 주행 속도를 불러 보렴.
1570,차량 제어,좌석 제어,좌석 통풍 켜기,너무 더우니까 좌석 통풍 기능도 켜.
1571,차량 제어,창문 제어,전체 창문 열기,창문을 모두 내려주라.
1572,차량 제어,자율 주행 시작,자율 주행 모드 시작,자율 주행 모드 활성화 부탁해
1573,차선 제어,차선 유지,차선 유지 모드 켜기,차선 유지 모드가 켜져 있는지 확인해 줘.
1574,차량 제어,창문 제어,전체 창문 열기,창문 전부 절반씩만 열어 줘.
1575,차선 제어,갓길 이동 정차,갓길 이동 명령,갓길 공간 남는 곳에 차 세워봐.
1576,차량 제어,좌석 제어,좌석 온도 제어,열선 시트 조금만 약하게 틀어 줘.
1577,차량 제어,좌석 제어,좌석 통풍 켜기,시트 팬 시작.
1578,차선 제어,차선 유지,차선 유지 모드 끄기,차선 유지 모드 내려 줘요.
1579,차선 제어,차선 변경,차선 변경,옆 차선이 더 낫겠다.
1580,차량 제어,공조 제어,에어컨 켜기,냉방이 필요해.
1581,차량 제어,긴급 차량,에스오에스차량 양보,구급차 지나갈 때까지 빠져있자.
1582,차량 제어,공조 제어,히터 끄기,더운데 히터 좀 꺼 줘.
1583,차량 제어,운전 제어,일자 추월,앞 차 추월하게 힘껏 가속해 줘.
1584,차선 제어,차선 변경,왼쪽으로 차선 변경,왼쪽으로 차선 갈아타 줘.
1585,차량 제어,도어 제어,전체 차문 열기,모든 승객 내리게 문 다 열어 줘.
1586,차량 제어,좌석 제어,좌석 통풍 끄기,뒷자리 시트 통풍 꺼 줘.
1587,주행 정보,주행 기록,자율 주행 주행 기록,자율 주행 제일 많이 쓴 지형들 알려 줘.
1588,차량 제어,좌석 제어,좌석 온도 올리기,운전석 온도 따뜻하게 데워 줘.
1589,주행 정보,주행 기록,자율 주행 주행 기록,자율 주행 얼마나 했나 리스트 업 해 봐.
1590,차량 제어,긴급 차량,에스오에스차량 양보,당연히 앰뷸런스에게 길 터 줘야지.
1591,차량 제어,속도 제어,주행 속도 세팅,어제 달린 속도 세팅 값 저장 해.
1592,차량 제어,공조 제어,에어컨 제어,에어컨 바람 너무 센데 조금만 낮춰 줘.
1593,차량 제어,공조 제어,히터 제어,강풍으로 설정해.
1594,차량 제어,운전 제어,일자 따라 가기,이 앞에 있는 차를 따라 가고 싶어.
1595,차량 제어,좌석 제어,좌석 온도 제어,열선 좀 달궈 봐.
1596,차량 제어,공조 제어,에어컨 켜기,차가 너무 더운 것 같아.
1597,비상 제어,보험사 연락,자동 보험사 연락,단순 접촉 사고 발생 시 보험사에 연락할지 물어봐 줘.
1598,주행 정보,속도 확인,자율 주행 속도 확인,자율 주행 지금 속력 어떻게 돼?
1599,차량 제어,공조 제어,에어컨 제어,에어컨 켜서 온도 차게 해 줘.
1600,비상 제어,차량 비상 정지,비상 정지 모드 켜기,비가 너무 많이 와서 비상 모드 킬게.
1601,차선 제어,갓길 이동 정차,갓길 이동 명령,차를 갓길에 이동해 줘.
1602,비상 제어,차량 비상 정지,비상 정지 모드 끄기,비상 정지 기능을 꺼도 돼.
1603,차량 제어,긴급 차량,에스오에스차량 양보,긴급 차량 통행을 위해서 길 만들어 줘.
1604,주행 정보,자율 주행 가능 여부,자율 주행 가능 여부 확인,자율 주행 가능한지 지금 교통 상황 확인해.
1605,주행 정보,자율 주행 가능 여부,자율 주행 가능 여부 확인,이 차량은 자율 주행이 가능한지 한 번 봐 줄 수 있어?
1606,주행 정보,주행 기록,자율 주행 주행 기록,최근에 자율 주행 기능한 날이 언젠인지 기록 확인해 줘.
1607,차량 제어,도어 제어,뒷자리 차문 닫기,운행 시작하면 뒷자리 차 문 잠가.
1608,비상 제어,차량 비상 정지,비상 정지 모드 켜기,자전거를 탄 사람이 차 쪽으로 튀어나오면 비상 정지 모드 해 줘.
1609,차량 제어,운전 제어,일자 따라 가기,앞에서 운전하는 차랑 계속 같은 길로 가.
1610,차량 제어,공조 제어,히터 끄기,히터 필요 없어.
1611,차선 제어,차선 유지,차선 유지 모드 켜기,차선 유지 모드를 써 볼래.
1612,차선 제어,갓길 이동 정차,갓길 이동 명령,맨 오른쪽 갓길로 차 이동해 줘.
1613,차선 제어,갓길 이동 정차,갓길 이동 명령,갓길로 빠져서 차 세워 줘.
1614,차량 제어,자율 주행 시작,자율 주행 모드 시작,자율 모드 켜서 운전 시작!
1615,차량 제어,공조 제어,에어컨 제어,에어컨 바람 위로 가게 해 줘.
1616,차선 제어,차선 변경,차선 변경,두 번째 차선으로 주행해 줘.
1617,차량 제어,공조 제어,에어컨 제어,에어컨 온도 살짝만 높게 해 줘.
1618,주행 정보,자율 주행 가능 여부,자율 주행 가능 여부 확인,자율 주행으로 지금 대신 운전해 줄 수 있어?
1619,차량 제어,공조 제어,히터 제어,지금 몇 도야 몇 도로 올려 줘.
1620,차량 제어,공조 제어,히터 제어,히터 바람 조금만 약하게 나오게 설정해 줘.
1621,차량 제어,운전 제어,일자 따라 가기,앞 차 놓치지 않도록 부탁해.
1622,차량 제어,긴급 차량,에스오에스차량 양보,앰뷸런스부터 앞으로 지나갈 공간 만들어 줘.
1623,주행 정보,주행 기록,자율 주행 주행 기록,이번 달 자율 주행 주행 기록의 모든 것이 필요해.
1624,차량 제어,도어 제어,전체 차문 열기,내릴 테니 문 좀 열어 봐.
1625,차량 제어,운전 제어,일자 따라 가기,나의 앞 차를 따라 가 주렴.
1626,차량 제어,도어 제어,전체 차문 열기,차 문 열 때 모든 문 열리게 해.
1627,비상 제어,보험사 연락,자동 보험사 연락,자동 보험사 연락 시스템 설정해 줘.
1628,차선 제어,갓길 이동 정차,갓길 이동 명령,차를 잠깐 갓길로 옮겨 봐.
1629,차량 제어,운전 제어,일자 추월,앞에 가고 있는 차 추월해.
1630,차량 제어,공조 제어,히터 제어,히터 다시 이십육 도로 맞춰 줘.
1631,주행 정보,속도 확인,자율 주행 속도 확인,현재 이 차의 자율 주행 속도 말하라.
1632,차량 제어,공조 제어,히터 제어,히터 풍량 조절 좀 해 줘.
1633,차량 제어,긴급 차량,에스오에스차량 양보,차 옆으로 붙여서 구급차 지나가게 해.
1634,차량 제어,공조 제어,에어컨 제어,에어컨 방향 좌우로 움직여 줘.
1635,비상 제어,보험사 연락,자동 보험사 연락,자동으로 보험사에 사고 접수해.
1636,주행 정보,주행 기록,자율 주행 주행 기록,대체 자율 주행으로 얼마나 달린 거니?
1637,주행 정보,주행 기록,자율 주행 주행 기록,이때까지 자율 주행으로 달린 거리 전부 합산해서 알려 줘.
1638,차량 제어,운전 제어,일자 따라 가기,앞 차 뒤를 밟아 줘.
1639,차선 제어,갓길 이동 정차,갓길 이동 명령,차 세워야 하는데 갓길 어디야?
1640,차량 제어,도어 제어,뒷자리 차문 열기,뒷자리 차문 개방 요청합니다.
1641,차량 제어,창문 제어,시동석 창문 열기,운전하게 운전석 창문 좀 열어봐.
1642,차선 제어,갓길 이동 정차,갓길 이동 명령,갓길 임시 정차 실행.
1643,차선 제어,갓길 이동 정차,갓길 이동 명령,피곤한데 갓길에서 좀 쉬다 가자.
1644,차선 제어,차선 유지,차선 유지 모드 끄기,차선 유지 취소!
1645,차량 제어,창문 제어,조수석 창문 열기,조수석 창문 삼분의 이 정도 내려 줄래?
1646,주행 정보,주행 기록,자율 주행 주행 기록,한 달간 자율 운행 몇 번 했는지 얘기해 줘.
1647,차량 제어,긴급 차량,에스오에스차량 양보,구급차 먼저 지나간 다음에 주행해.
1648,비상 제어,차량 비상 정지,비상 정지 모드 켜기,비상 정지 모드 키자.
1649,차선 제어,갓길 이동 정차,갓길 이동 명령,고가에서 터널 가는 길에 잠시 갓길에 정차해 줘.
1650,주행 정보,주행 기록,자율 주행 주행 기록,방금 전 자율 주행에 대한 정보 알려 줘.
1651,차선 제어,갓길 이동 정차,갓길 이동 명령,갓길에 멈추자.
1652,차량 제어,속도 제어,주행 속도 세팅,속도 시속 팔십 킬로미터로 맞추고 주행해.
1653,차량 제어,창문 제어,조수석 창문 열기,조수석 창문 십 센치미터만 열어 줘.
1654,차량 제어,운전 제어,일자 추월,앞 차보다 앞서서 가자.
1655,차량 제어,운전 제어,일자 추월,앞 차 앞으로 위치 이동해.
1656,차량 제어,속도 제어,주행 속도 세팅,밖이 어두우니 천천히 주행해 줘.
1657,차량 제어,좌석 제어,좌석 통풍 켜기,좌석 통풍 켜기.
1658,차량 제어,공조 제어,에어컨 제어,앞 좌석 에어컨만 켜.
1659,차량 제어,좌석 제어,좌석 통풍 끄기,좌석에 통풍 기능을 꺼 줘.
1660,차량 제어,운전 제어,일자 따라 가기,앞 차 뒤에만 있으면 돼.
1661,차량 제어,운전 제어,일자 추월,앞에 한 대만 앞질러 줘.
1662,비상 제어,차량 비상 정지,비상 정지 모드 켜기,비상 정지 모드 지원 부탁 해.
1663,차량 제어,창문 제어,조수석 창문 열기,조수석 창문 모두 개방해 줘.
1664,차량 제어,도어 제어,조수석 차문 열기,조수석에 누구 타게 차 문 잠시 열어 놔.
1665,차량 제어,운전 제어,일자 따라 가기,앞 차 가는 길 따라 가.
1666,주행 정보,주행 기록,자율 주행 주행 기록,자율 주행 총 운행 거리 합계 내 줘.
1667,차량 제어,좌석 제어,좌석 통풍 끄기,통풍 시트 작동 해제.
1668,차량 제어,공조 제어,히터 제어,너무 더우니까 히터 줄여.
1669,차선 제어,차선 변경,차선 변경,다인승 차선으로 가자.
1670,차량 제어,도어 제어,전체 차문 열기,차 정차하면 문 다 열어 줘.
1671,차선 제어,갓길 이동 정차,갓길 이동 명령,갓길에서 잠시 자고 갈래.
1672,차량 제어,공조 제어,에어컨 제어,에어컨 팍팍 틀어 줘.
1673,차선 제어,차선 변경,왼쪽으로 차선 변경,뭔가 이 차선이 불안한데 왼쪽 차선으로 갔으면 좋겠어.
1674,차량 제어,속도 제어,주행 속도 세팅,오늘 운전 속력은 시속 육십으로 세팅 부탁해.
1675,차량 제어,도어 제어,조수석 차문 열기,조수석 차 문 지금 잠금 풀어 열어 줘.
1676,차량 제어,창문 제어,조수석 창문 닫기,추우니까 조수석 창문 완벽히 닫아 줄래?
1677,차량 제어,좌석 제어,좌석 온도 올리기,나 좀 추운데 시트 따뜻하게 해 줄래?
1678,차량 제어,공조 제어,히터 끄기,히터 모드 동작 그만.
1679,차량 제어,운전 제어,일자 추월,앞에 있는 차량을 넘어서 가 줘.
1680,차량 제어,좌석 제어,좌석 온도 제어,틀어져 있는 시트 모두 꺼 줄래?
1681,차량 제어,창문 제어,조수석 창문 닫기,환기는 충분하니 조수석 창 좀 닫아.
1682,차량 제어,공조 제어,히터 제어,히터 온풍만 살짝 틀어 줘.
1683,차량 제어,좌석 제어,좌석 온도 올리기,나 여기 자리 좀 데워 줘.
1684,차량 제어,공조 제어,히터 켜기,히터로 공기 따뜻하게 해.
1685,비상 제어,차량 비상 정지,비상 정지 모드 켜기,비상 정지 모드 켜서 도와 줘.
1686,차선 제어,갓길 이동 정차,갓길 이동 명령,갓길 보이면 일시 정차해.
1687,차량 제어,공조 제어,히터 제어,히터 온도 업 플리즈.
1688,주행 정보,속도 확인,자율 주행 속도 확인,지금 이 차량 몇 킬로미터로 자율 주행 중이니?
1689,차선 제어,차선 변경,오른쪽으로 차선 변경,앞에 차처럼 오른쪽 차선으로 가자.
1690,비상 제어,차량 비상 정지,비상 정지 모드 켜기,주황 불로 바뀌는데 비상 정지 모드 켜 줘.
1691,차량 제어,좌석 제어,좌석 온도 내리기,운전석 빼고 나머지 시트 전부 시원하게 만들어.
1692,차선 제어,차선 변경,왼쪽으로 차선 변경,깜빡이 켜고 왼쪽으로 들어가.
1693,차선 제어,갓길 이동 정차,갓길 이동 명령,갓길로 가보자 일단.
1694,차량 제어,도어 제어,뒷자리 차문 열기,차 정차 하면 뒷차리 차 문 다 열어 줘.
1695,차량 제어,좌석 제어,좌석 통풍 켜기,통풍 기능 실행해 줘.
1696,차량 제어,운전 제어,일자 추월,선행 차보다 앞질러 갑시다.
1697,비상 제어,차량 비상 정지,비상 정지 모드 켜기,차량 비성 정지 모드로 실행.
1698,차량 제어,긴급 차량,에스오에스차량 양보,경찰차 올때까지 잠깐 서있어.
1699,차량 제어,운전 제어,일자 추월,운전 속도는 앞에 차보다 빨리해 줘.
1700,차선 제어,갓길 이동 정차,갓길 이동 명령,전방에 있는 갓길에 세워야 하는데 도와줄래?
1701,차량 제어,도어 제어,뒷자리 차문 열기,누가 탈거야 뒷자리 차 문 열어 둬.
1702,차량 제어,도어 제어,뒷자리 차문 닫기,뒷자리 문 모두 잠궜으면 좋겠어.
1703,차량 제어,창문 제어,전체 창문 닫기,한꺼번에 창문 다 닫아.
1704,차량 제어,창문 제어,전체 창문 열기,공기 안 좋은 곳에 오면 자동으로 모든 창문 올려 줘.
1705,차량 제어,좌석 제어,좌석 통풍 켜기,보조석 시트 통풍하게 작동해.
1706,차선 제어,갓길 이동 정차,갓길 이동 명령,갓길에 정차해야 할 일이 생겼어.
1707,차량 제어,속도 제어,주행 속도 세팅,주행 속도 팔십으로 고치고 싶어.
1708,차선 제어,차선 변경,오른쪽으로 차선 변경,오른쪽 차선으로 옮겨 가자.
1709,차량 제어,긴급 차량,에스오에스차량 양보,구급차가 지나갈 수 있도록 운행해 줘.
1710,주행 정보,주행 기록,자율 주행 주행 기록,나 이번 주 자율 주행 기록 필요해 정리해 줘.
1711,차선 제어,갓길 이동 정차,갓길 이동 명령,차 세울 건데 갓길로 가자.
1712,차량 제어,도어 제어,조수석 차문 닫기,조수석이 문이 제대로 안 닫혔어 다시 닫아 줄래?
1713,차선 제어,갓길 이동 정차,갓길 이동 명령,갓길로 가서 쉬자.
1714,주행 정보,주행 기록,자율 주행 주행 기록,이 월 이 일 두 시 자율 주행 주행 기록 말해 줘.
1715,비상 제어,차량 비상 정지,비상 정지 모드 켜기,지금 나에게 필요한 것은 비상 정지 모드야.
1716,주행 정보,주행 기록,자율 주행 주행 기록,오늘 자율 주행한 기록 계산해 줘.
1717,차량 제어,속도 제어,주행 속도 세팅,도로 상황에 알맞은 주행 속도를 추천해 줘.
1718,비상 제어,보험사 연락,자동 보험사 연락,비상 상황 판단되면 보험사 담당자 호출 해.
1719,차량 제어,운전 제어,일자 따라 가기,앞 차에 속도 맞추고 가는 게 나아.
1720,차량 제어,긴급 차량,에스오에스차량 양보,병원 근처니까 구급차 먼저 보내드리자.
1721,차량 제어,운전 제어,일자 추월,저 차를 앞질러 버리자
1722,차량 제어,공조 제어,에어컨 제어,에어컨 온도 아주 시원하게 바꿔.
1723,비상 제어,보험사 연락,자동 보험사 연락,보험사 전화 해서 여기로 오라고 전해 줘.
1724,주행 정보,속도 확인,자율 주행 속도 확인,지금 자율 주행 속도가 어떻게 되는지 알려 줘.
1725,차선 제어,갓길 이동 정차,갓길 이동 명령,앞에 보이는 갓길에 잠시 서 줘.
1726,차선 제어,차선 유지,차선 유지 모드 끄기,차선 유지 모드 취소해.
1727,차량 제어,공조 제어,히터 켜기,지금 히터 켜는 것도 좋을 거 같다.
1728,주행 정보,주행 기록,자율 주행 주행 기록,자율 주행으로 갈 수 있는 거리인지 계산 좀 해 줘.
1729,차량 제어,운전 제어,일자 추월,속도 높여서 내 앞에 있는 차 추월해 줘.
1730,차량 제어,도어 제어,전체 차문 열기,환기 시키 게 모든 차 문 다 열어 줘.
1731,주행 정보,주행 기록,자율 주행 주행 기록,요즘 자율 주행 얼마나 사용했는지 사용 기록 확인해 줄래?
1732,차량 제어,공조 제어,히터 제어,히터 최대 세기로.
1733,차량 제어,자율 주행 시작,자율 주행 모드 시작,자율 주행 모드 켜지도록 해 줘.
1734,주행 정보,주행 기록,자율 주행 주행 기록,최대 속도 낸 자율 주행 기록 알려 줘.
1735,차선 제어,차선 유지,차선 유지 모드 끄기,차선 유지 모드 죽여 줘.
1736,차량 제어,좌석 제어,좌석 온도 제어,뒷좌석 시트 열선 꺼 줘.
1737,차량 제어,공조 제어,히터 끄기,히터를 끄도록 해 줘.
1738,차량 제어,운전 제어,일자 추월,앞 차 넘어 가.
1739,주행 정보,자율 주행 가능 여부,자율 주행 가능 여부 확인,자율 주행 허용된 도로인가요?
1740,차선 제어,갓길 이동 정차,갓길 이동 명령,갓길로 잠깐 들어서 줘.
1741,비상 제어,차량 비상 정지,비상 정지 모드 켜기,비상 정지 빨리 켜 줘.
1742,비상 제어,보험사 연락,자동 보험사 연락,자동으로 보험 담당자를 불러 주세요.
1743,차량 제어,자율 주행 시작,자율 주행 모드 종료,이제는 자율 주행 모드 안 할래.
1744,차선 제어,차선 변경,차선 변경,차간거리 확보하고 차선 변경해 줘.
1745,비상 제어,보험사 연락,자동 보험사 연락,차 배터리 방전되면 다이렉트로 보험사랑 통화되게 해 줘.
1746,차량 제어,운전 제어,일자 따라 가기,앞 차 꼬리 물고 가 줘.
1747,차량 제어,운전 제어,일자 추월,앞에 차 보이지 저거 추월해.
1748,차량 제어,공조 제어,에어컨 제어,제일 낮은 온도로 설정해.
1749,차선 제어,갓길 이동 정차,갓길 이동 명령,잠깐 갓길에 대봐.
1750,차량 제어,운전 제어,일자 따라 가기,앞 차 차선 변경하기 전까지 따라 가 줘.
1751,비상 제어,보험사 연락,자동 보험사 연락,나에게 문제가 생기면 곧 바로 보험사로 연결 해.
1752,차량 제어,공조 제어,에어컨 끄기,에어컨 춥다 꺼 줘.
1753,차량 제어,자율 주행 시작,자율 주행 모드 종료,자율 주행 모드 오프로 전환 부탁해.
1754,차량 제어,긴급 차량,에스오에스차량 양보,긴급 차량 내 앞으로 지나가게 해 줘.
