No.,도메인,세부 도메인,의도 (Intention),문장
1,차량 제어,운전 제어,일자 따라 가기,앞 차 뒤에서 똑같이 가 줘.
2,주행 정보,주행 기록,자율 주행 주행 기록,최근 일주일 동안 자율 주행할 때 가장 많이 사용했던 기능 알려 줘.
3,차량 제어,도어 제어,조수석 차문 열기,조수석 차 문 여는 거 도와 줘.
4,차량 제어,공조 제어,에어컨 제어,에어컨 온도 밑으로 내려 줘.
5,차량 제어,속도 제어,주행 속도 세팅,차를 오십으로 몰아 주세요.
6,차량 제어,좌석 제어,좌석 통풍 켜기,전 좌석에 바람이 순환되게 해 줘.
7,비상 제어,보험사 연락,자동 보험사 연락,차량의 주행이 불가능하면 보험사에 연락과 동시에 견인 요청을 해 줘.
8,차량 제어,도어 제어,전체 차문 열기,문 좀 다 열면 좋겠다.
9,주행 정보,주행 기록,자율 주행 주행 기록,현재 자율 주행 운행 일지를 보고 싶어요.
10,주행 정보,자율 주행 가능 여부,자율 주행 가능 여부 확인,비포장도로에서도 자율 주행이 가능한지 알려 줘.
11,차선 제어,차선 변경,오른쪽으로 차선 변경,오른쪽 방향으로 차선을 움직여 줘.
12,차량 제어,긴급 차량,에스오에스차량 양보,앰뷸런스 빨리 지나가야 하니까 비켜 줘.
13,비상 제어,보험사 연락,자동 보험사 연락,보험사 자동 연결 통화 부탁 해.
14,차량 제어,자율 주행 시작,자율 주행 모드 시작,끈 자율 주행 모드 다시 켜 줘.
15,주행 정보,자율 주행 가능 여부,자율 주행 가능 여부 확인,자율 주행 가능한지 확인해 봐 줘.
16,차량 제어,운전 제어,일자 따라 가기,앞 차 뒤에서 따라 달려 줘.
17,차량 제어,좌석 제어,좌석 온도 내리기,슬슬 더우니 시트 온도 낮춰 줘.
18,차량 제어,도어 제어,뒷자리 차문 열기,뒷자리 차 문 열어 줘라.
19,차량 제어,운전 제어,일자 추월,네가 앞 차 좀 추월해 줘.
20,주행 정보,주행 기록,자율 주행 주행 기록,주행 기록을 보고 싶은데 주행 정보로 들어가 줘.
21,주행 정보,자율 주행 가능 여부,자율 주행 가능 여부 확인,자율 주행하고 싶은데 지금 상황 어떤지 체크 좀 해 줄래?
22,주행 정보,자율 주행 가능 여부,자율 주행 가능 여부 확인,지금 여기 자율 주행 가능한 곳이야?
23,차선 제어,갓길 이동 정차,갓길 이동 명령,갓길로 지금 가야 해.
24,차량 제어,긴급 차량,에스오에스차량 양보,지금 뒤에 붙은 앰뷸런스를 위해 옆 길로 빠져 줘.
25,차선 제어,갓길 이동 정차,갓길 이동 명령,전방에 갓길로 안내해 줘.
26,차량 제어,좌석 제어,좌석 온도 올리기,의자 데워 줘.
27,차량 제어,긴급 차량,에스오에스차량 양보,후송 차량이 지나가게 도와 줘.
28,차량 제어,좌석 제어,좌석 온도 올리기,시트 온도 더 따뜻하게 올려 줘.
29,주행 정보,자율 주행 가능 여부,자율 주행 가능 여부 확인,자율 주행 이용 불가능한 도로인지 말해 줘.
30,차선 제어,차선 변경,차선 변경,오백 미터 앞에서 이 차선으로 차선 변경.
31,차량 제어,운전 제어,일자 추월,앞 차보다 앞서가 줘.
32,차선 제어,갓길 이동 정차,갓길 이동 명령,차량 시스템 문제 생기면 갓길로 차 이동해 줘.
33,차선 제어,갓길 이동 정차,갓길 이동 명령,갓길에 섰을 때 비상 정지 기능 켜 줘.
34,차량 제어,긴급 차량,에스오에스차량 양보,구급차 먼저 통행할 수 있도록 운전해 줘.
35,차량 제어,공조 제어,히터 제어,히터 온도를 낮추고 싶어.
36,차량 제어,공조 제어,히터 제어,히터 바람 제일 세게 전환해 줘.
37,차량 제어,좌석 제어,좌석 온도 내리기,좌석 온도 조금 더 낮게 수정해.
38,비상 제어,보험사 연락,자동 보험사 연락,보험사에 연락과 동시에 블랙박스 영상을 전송해 줘.
39,차선 제어,차선 변경,오른쪽으로 차선 변경,역전 사거리 지나서 오른쪽 차로로 바꿔서 쭉 가.
40,차량 제어,공조 제어,에어컨 제어,에어컨으로 더 시원한 바람 불어 주겠니?
41,차량 제어,긴급 차량,에스오에스차량 양보,앰뷸런스 오고 있으니까 길을 터 줘야 해.
42,차량 제어,공조 제어,히터 제어,추우니까 히터 바람 파워로 틀어 줄래?
43,차선 제어,차선 변경,오른쪽으로 차선 변경,차를 우측 차선 따라 운행해.
44,비상 제어,차량 비상 정지,비상 정지 모드 켜기,차 내부에 문제 생기면 비상 정지 기능 켜 줘.
45,차량 제어,운전 제어,일자 추월,더 빨리 달려서 앞 차 지나가자.
46,차선 제어,갓길 이동 정차,갓길 이동 명령,긴급상황이라 차 갓길로 이동해 줘.
47,차량 제어,공조 제어,히터 제어,히터로 더 따뜻하게 머물고 싶어.
48,차량 제어,창문 제어,전체 창문 닫기,아무것도 들어오지 못하게 전체 창문 올려 줘.
49,차량 제어,운전 제어,일자 추월,앞 차보다 빨리 좀 가 줘.
50,비상 제어,보험사 연락,자동 보험사 연락,자율주행 운전 시 문제 생기면 바로 보험사에 연락해 줘.
51,주행 정보,주행 기록,자율 주행 주행 기록,자율 주행 주 목적지는 어디인지 알려 줘.
52,차량 제어,공조 제어,히터 제어,운전석 히터만 작동시켜 줘.
53,비상 제어,차량 비상 정지,비상 정지 모드 끄기,비상 정지 모드 없애라.
54,비상 제어,보험사 연락,자동 보험사 연락,아홉시에 사고가 났는데 바로 보험사한테 전화해 줘.
55,차량 제어,좌석 제어,좌석 통풍 켜기,내 옆자리 통풍 잘 되게 해 줘.
56,차선 제어,갓길 이동 정차,갓길 이동 명령,휴식이 필요하니 앞에 있는 갓길에 내 차 정차시켜.
57,주행 정보,자율 주행 가능 여부,자율 주행 가능 여부 확인,어제 잠을 못 자서 피곤한데 자율 주행 가능해?
58,차량 제어,공조 제어,히터 제어,히터 바람 방향 올려 줘.
59,차량 제어,자율 주행 시작,자율 주행 모드 종료,자율 주행 끌래.
60,비상 제어,보험사 연락,자동 보험사 연락,보험사 자동 호출 걸어 둬.
61,차량 제어,도어 제어,조수석 차문 닫기,조수석 문에 락 걸어 줘.
62,차량 제어,속도 제어,주행 속도 세팅,차량 속도 오십으로 맞춰 줘.
63,차선 제어,갓길 이동 정차,갓길 이동 명령,빨리 갓길로 몰아.
64,차량 제어,긴급 차량,에스오에스차량 양보,경찰차를 위해 양보해 줘.
65,차량 제어,좌석 제어,좌석 온도 제어,좌석 온도 제어 기능 운전석 빼고 다 꺼 줘.
66,차량 제어,도어 제어,뒷자리 차문 열기,뒷자리 차 문 열린곳 있는지 확인해 줘.
67,차선 제어,갓길 이동 정차,갓길 이동 명령,잠깐 갓길에 차 세워두자.
68,차량 제어,긴급 차량,에스오에스차량 양보,구급차 우선으로 갈 수 있게 해 줘.
69,비상 제어,보험사 연락,자동 보험사 연락,내 외부 트러블 생기면 담당 보험사에게 전화 연결.
70,주행 정보,주행 기록,자율 주행 주행 기록,가장 긴 자율 주행 기록은 뭐였어?
71,차량 제어,도어 제어,뒷자리 차문 열기,뒷자리 차문 오른쪽만 열어 줘.
72,비상 제어,차량 비상 정지,비상 정지 모드 켜기,비상 정지 모드를 켜 줘.
73,차량 제어,창문 제어,조수석 창문 열기,너무 덥다 조수석 창문 좀 열어 줘.
74,주행 정보,주행 기록,자율 주행 주행 기록,자율 주행 운행 기록 궁금해.
75,차량 제어,자율 주행 시작,자율 주행 모드 종료,자율 주행으로 달리던 거 스탑해 줘.
76,비상 제어,차량 비상 정지,비상 정지 모드 끄기,비상 정지 모드 끄자.
77,차량 제어,운전 제어,일자 따라 가기,앞 차보다 먼저 가지 말고 따라 가.
78,비상 제어,차량 비상 정지,비상 정지 모드 켜기,위급상황시에 바로 정지 모드 작동시켜.
79,차량 제어,운전 제어,일자 따라 가기,앞 차랑 안전거리 유지하고 운전해.
80,차량 제어,좌석 제어,좌석 온도 제어,더우니까 좌석 시트 제어 기능 꺼.
81,차선 제어,차선 변경,차선 변경,국도 달릴 때 네가 자동 차선 변경해 줘.
82,차량 제어,도어 제어,뒷자리 차문 열기,목적지 도착 후 뒷자리 차 문 열어.
83,주행 정보,주행 기록,자율 주행 주행 기록,자율 주행 모드 변경 언제 했는지 보고해.
84,차량 제어,창문 제어,조수석 창문 열기,바람 들어오게 조수석 창문 열어 줘.
85,차선 제어,갓길 이동 정차,갓길 이동 명령,가는 길에 갓길 있으면 세워.
86,비상 제어,차량 비상 정지,비상 정지 모드 끄기,너가 운전할 때 비상 정지 기능 오프.
87,차선 제어,차선 유지,차선 유지 모드 켜기,한 차선으로 유지해 놓고 주행하자.
88,주행 정보,자율 주행 가능 여부,자율 주행 가능 여부 확인,자율 주행 괜찮을까?
89,차량 제어,좌석 제어,좌석 통풍 켜기,좌석 공기 맑게 해 줘.
90,차량 제어,창문 제어,시동석 창문 닫기,시동석 창문 좀 닫아 줬으면 좋겠어.
91,차선 제어,차선 유지,차선 유지 모드 켜기,차선을 밟을 때에만 핸들에 개입해 줘.
92,주행 정보,주행 기록,자율 주행 주행 기록,자율 주행으로 달린 거리를 계산해 줘.
93,차량 제어,운전 제어,일자 추월,잎에 보이는 차보다 더 빠르게 가주면 안돼?
94,비상 제어,보험사 연락,자동 보험사 연락,보험사 연락 자동 연결 시켜 줘.
95,비상 제어,차량 비상 정지,비상 정지 모드 켜기,너가 운전할 때 비상 정지 온.
96,차량 제어,창문 제어,조수석 창문 열기,조수석 창문 여시오.
97,차량 제어,공조 제어,히터 제어,히터 바람 방향 아래로 바꿔 줘.
98,차량 제어,자율 주행 시작,자율 주행 모드 종료,자율 운행 시스템 꺼 줘.
99,차량 제어,도어 제어,조수석 차문 닫기,지금 조수석 차문 열러 있으면 닫아주라.
100,차량 제어,창문 제어,전체 창문 열기,전체 창문 반 씩 다 열어 줘.
101,차량 제어,도어 제어,뒷자리 차문 열기,뒷 문으로 사람 들어올 거야.
102,차량 제어,공조 제어,에어컨 제어,에어컨 온도 올리자.
103,비상 제어,보험사 연락,자동 보험사 연락,가입한 보험사에 자동으로 연결 해라.
104,차량 제어,긴급 차량,에스오에스차량 양보,바로 뒤에서 경찰차 사이렌이 울리면 갓길에 정차해 줘.
105,주행 정보,자율 주행 가능 여부,자율 주행 가능 여부 확인,자율 주행에 적합한지 체크.
106,차선 제어,차선 변경,차선 변경,차선을 다른 쪽으로 변경해서 가면 좋을 거 같아.
107,차량 제어,속도 제어,주행 속도 세팅,너무 빠른 것 같은데 시속 팔십 킬로미터로 주행해.
108,주행 정보,자율 주행 가능 여부,자율 주행 가능 여부 확인,자율 주행 모드 온 가능한지 확인해 줘.
109,차량 제어,창문 제어,조수석 창문 닫기,바람이 들어오니깐 조수석 창문 닫아 줘.
110,차량 제어,도어 제어,뒷자리 차문 열기,아기 타야 하니까 뒷자리 차 문 다 열어 줘.
111,차량 제어,운전 제어,일자 따라 가기,앞에 차랑 목적지가 같으니까 따라서 가.
112,비상 제어,차량 비상 정지,비상 정지 모드 끄기,비상 정지 모드가 더 이상 필요하지 않아.
113,차선 제어,차선 변경,왼쪽으로 차선 변경,이제 곧 좌회전 해야 하니까 차선 왼쪽으로 바꿔 줘.
114,차량 제어,좌석 제어,좌석 통풍 끄기,좌석 통풍 때문에 소름 돋아 이제 꺼 줘.
115,차량 제어,긴급 차량,에스오에스차량 양보,경찰차가 빨리 갈 수 있도록 해주자.
116,차량 제어,좌석 제어,좌석 통풍 켜기,운전석 의자 시원하게 켜 줘.
117,차량 제어,긴급 차량,에스오에스차량 양보,에스오에스 차량은 양보 받는 차야.
118,차선 제어,갓길 이동 정차,갓길 이동 명령,가 쪽 길에 세워.
119,차량 제어,공조 제어,히터 켜기,히터로 손 좀 녹여야겠어.
120,차량 제어,공조 제어,히터 제어,지금 차내 온도 몇 도인지 확인해 주고 히터 온도 조금만 더 높여 줘.
121,차선 제어,차선 변경,차선 변경,사 차선으로 진입해.
122,차량 제어,창문 제어,조수석 창문 닫기,조수석 창문 완전히 올려 줘.
123,비상 제어,보험사 연락,자동 보험사 연락,지금 보험사랑 자동으로 콜 해 줘.
124,차량 제어,자율 주행 시작,자율 주행 모드 시작,운전 상태 자율 주행으로 바꿔주면 좋겠어.
125,비상 제어,보험사 연락,자동 보험사 연락,보험사 자동 연결 필요해.
126,주행 정보,주행 기록,자율 주행 주행 기록,출퇴근 구간 자율 주행 주행 기록 확인해 줘.
127,차량 제어,도어 제어,뒷자리 차문 열기,곧 타게 뒷자리 열어 줘.
128,차량 제어,속도 제어,주행 속도 세팅,내가 달릴 속도 세팅해서 주행해 줄래?
129,주행 정보,속도 확인,자율 주행 속도 확인,자율 주행 속도 얼마나 되는지 가르쳐 줘.
130,차량 제어,좌석 제어,좌석 온도 올리기,혹시 모든 좌석 따뜻하게 설정해 줄 수 있을까?
131,차선 제어,차선 변경,오른쪽으로 차선 변경,뒤 차 비켜주게 우측으로 차선 이동하자.
132,주행 정보,주행 기록,자율 주행 주행 기록,자율 주행 주행 기록 쭉 불러 줘.
133,비상 제어,차량 비상 정지,비상 정지 모드 켜기,주차장까지 비상 정지 모드 켜 줄래?
134,차량 제어,속도 제어,주행 속도 세팅,속도 조금씩 올려 줘.
135,차량 제어,공조 제어,에어컨 제어,에어컨 파워 냉방으로 전환해 줘.
136,주행 정보,주행 기록,자율 주행 주행 기록,자율 주행으로 얼마나 다녔어?
137,주행 정보,주행 기록,자율 주행 주행 기록,너에게 기록된 모든 자율 주행 기록을 정리해 줘.
138,비상 제어,보험사 연락,자동 보험사 연락,차 배터리 방전되면 자동으로 보험사랑 통화되게 해 줘.
139,차량 제어,공조 제어,에어컨 제어,에어컨 바람 회전해 줘.
140,주행 정보,주행 기록,자율 주행 주행 기록,총 자율 주행 누적 시간 계산해 줘.
141,차량 제어,운전 제어,일자 추월,앞에 있는 택시 추월해 줘.
142,비상 제어,보험사 연락,자동 보험사 연락,보험사에 저절로 연락 가게 해 줘.
143,차량 제어,도어 제어,전체 차문 닫기,안 닫힌 모든 차 문 다 닫아.
144,주행 정보,주행 기록,자율 주행 주행 기록,최근 이 개월 동안의 자율 주행 기록 보여 줘.
145,차선 제어,차선 변경,차선 변경,이 차선으로 차선 변경 도와주겠니?
146,비상 제어,차량 비상 정지,비상 정지 모드 끄기,비상 정지 모드 끄고 이동해 줘.
147,차량 제어,운전 제어,일자 따라 가기,내 앞에 있는 차 뒤에 붙어서 가자.
148,비상 제어,보험사 연락,자동 보험사 연락,자동으로 보험사에 연락 해야 할 상황이야.
149,차선 제어,차선 변경,차선 변경,주행 차선으로 바꿔 봐.
150,차량 제어,도어 제어,전체 차문 열기,모두 다 타야 하니까 전체 차 문 동시에 다 같이 열어 줘.
151,차량 제어,운전 제어,일자 추월,앞에 있는 차 앞지르기 해 버리자.
152,차량 제어,도어 제어,전체 차문 열기,무슨 냄새가 나는데 차 문 다 열어 줘 환기 해야겠어.
153,차량 제어,창문 제어,전체 창문 닫기,조용히 운전하고 싶으니 전체 창문 위로 올려 줘.
154,차량 제어,도어 제어,전체 차문 열기,이제 출발하니까 모든 문 닫아 줘.
155,차량 제어,운전 제어,일자 추월,빠르게 가서 앞 차를 추월하기 바랍니다.
156,차량 제어,자율 주행 시작,자율 주행 모드 시작,자율모드로 운전하겠습니다.
157,비상 제어,보험사 연락,자동 보험사 연락,보험사 자동으로 연락할 수 있게 해 줄래?
158,차량 제어,운전 제어,일자 추월,앞 차보다 빨리 가야 할 듯해.
159,차선 제어,갓길 이동 정차,갓길 이동 명령,갓길에 차 좀 댈게.
160,차량 제어,운전 제어,일자 따라 가기,내 앞 차 따라 속도 내 줄래?
161,주행 정보,주행 기록,자율 주행 주행 기록,자율 주행으로 갔던 곳 어디야?
162,비상 제어,차량 비상 정지,비상 정지 모드 켜기,차 수리할 동안 비상 정지 모드 켜 줘.
163,차량 제어,속도 제어,주행 속도 세팅,시내 주행 속도는 시속 육십 킬로미터를 넘지 않도록 해 줘.
164,차선 제어,갓길 이동 정차,갓길 이동 명령,갓길로 이동해서 정차할게.
165,주행 정보,주행 기록,자율 주행 주행 기록,오늘의 자율 주행 내용 요약해 줘.
166,차량 제어,운전 제어,일자 따라 가기,앞 차랑 일 키로 거리 유지하면서 계속 따라 가.
167,비상 제어,보험사 연락,자동 보험사 연락,현대보험사에 연락해 줄래?
168,차량 제어,운전 제어,일자 따라 가기,전방에 있는 흰색 차 가는 대로 따라 가 줘.
169,차선 제어,갓길 이동 정차,갓길 이동 명령,건물 좀 확인하게 앞에 갓길에 잠깐 세워 줘.
170,주행 정보,속도 확인,자율 주행 속도 확인,자율 주행 속도 띄워 줘.
171,비상 제어,보험사 연락,자동 보험사 연락,혹시 사고 나면 보험사에 자동으로 전화 해 줄 수 있어?
172,차량 제어,공조 제어,히터 제어,히터 너무 강하지 않게 틀어 줘.
173,차량 제어,운전 제어,일자 추월,속도 좀 높여서 앞 차 이겨 줘.
174,주행 정보,주행 기록,자율 주행 주행 기록,여태까지 자율 주행으로 얼마나 다녔는지 알려 줘.
175,차량 제어,긴급 차량,에스오에스차량 양보,구급차 지나가면 양보해.
176,차량 제어,속도 제어,주행 속도 세팅,도로 제한 속도까지 주행 속도 단계적으로 올려 줘.
177,차량 제어,도어 제어,뒷자리 차문 닫기,뒷좌석 문 잠금 장치 완료.
178,차량 제어,공조 제어,히터 제어,이 도 이상 높여 줘.
179,차량 제어,도어 제어,조수석 차문 닫기,조수석 빨리 문 닫아 줘.
180,차량 제어,도어 제어,전체 차문 닫기,출발 시 모든 차문 잠금 해 줘.
181,주행 정보,주행 기록,자율 주행 주행 기록,자율 주행으로 이동한 거리 표시해 봐.
182,차량 제어,좌석 제어,좌석 통풍 켜기,시트 바람 통하게 해 줘.
183,차량 제어,창문 제어,전체 창문 닫기,전체 창문 전부 닫아.
184,차량 제어,좌석 제어,좌석 온도 내리기,시트 온도가 일도 낮았으면 좋겠어.
185,차량 제어,도어 제어,조수석 차문 열기,지금 조수석에 손님 타야 하니까 열어 줘.
186,차량 제어,자율 주행 시작,자율 주행 모드 시작,고속도로에서만 자율 주행 해 줘.
187,차량 제어,속도 제어,주행 속도 세팅,터널 안에서 주행 속도 줄여서 운전해 줘.
188,차량 제어,도어 제어,전체 차문 닫기,전체 차 문 자동 닫힘 적용해 줘.
189,차량 제어,속도 제어,주행 속도 세팅, 좀 더 빠르게 달리자.
190,차선 제어,차선 변경,오른쪽으로 차선 변경,지금 비어 있는 우측 차선으로 바꿔.
191,차량 제어,좌석 제어,좌석 온도 올리기,좌석 온도를 올려 줬으면 좋겠어.
192,주행 정보,주행 기록,자율 주행 주행 기록,최근에 자율 주행 모드로 이용했던거 확인해 줘.
193,주행 정보,주행 기록,자율 주행 주행 기록,자율 주행한 내역 있으면 보여 줘.
194,차량 제어,긴급 차량,에스오에스차량 양보,구급 차량 지나간 후에 가자.
195,차선 제어,갓길 이동 정차,갓길 이동 명령,잠깐만 갓길에 차 세워 주라.
196,차선 제어,갓길 이동 정차,갓길 이동 명령,차 많이 안 다니는 갓길에 정차해 줘.
197,차량 제어,공조 제어,에어컨 제어,에어컨 온도 너무 높아.
198,차량 제어,좌석 제어,좌석 온도 올리기,운전석이 좀 더 따뜻했으면 좋겠어.
199,비상 제어,보험사 연락,자동 보험사 연락,차체가 침수되면 보험사에 연락해 줘.
200,비상 제어,보험사 연락,자동 보험사 연락,자동 보험사 연락 기능 설정해 줘.
201,주행 정보,주행 기록,자율 주행 주행 기록,내가 자율 주행 기능을 자주 이용하고 있는지 알려 줘.
202,차량 제어,창문 제어,전체 창문 닫기,바람 많이 부니깐 창 전체 올려 줘.
203,차선 제어,갓길 이동 정차,갓길 이동 명령,넓은 갓길에 세워 줘.
204,차량 제어,자율 주행 시작,자율 주행 모드 시작,자율 주행 모드로 나 데려다 줘.
205,비상 제어,차량 비상 정지,비상 정지 모드 켜기,비상 정지 모드로 진행해 줘.
206,차량 제어,긴급 차량,에스오에스차량 양보,옆으로 비켜서 구급차 갈 수 있게 길 확보해 줘.
207,차량 제어,속도 제어,주행 속도 세팅,시속 육십 이하로 도로 상황 보며 달려 줘.
208,차선 제어,갓길 이동 정차,갓길 이동 명령,갓길에서 잠깐 쉴 게.
209,주행 정보,주행 기록,자율 주행 주행 기록,두 시까지 자율 주행 기록 불러 와 줄 수 있니?
210,차선 제어,갓길 이동 정차,갓길 이동 명령,위급하니까 갓길로 차 이동해 줘.
211,주행 정보,주행 기록,자율 주행 주행 기록,자율 주행 기록을 봐야겠어.
212,차량 제어,긴급 차량,에스오에스차량 양보,에스오에스 차량이 지나가면 무조건 양보해.
213,차량 제어,운전 제어,일자 따라 가기,놓치지 말고 잘 붙어서 따라 가자.
214,차량 제어,좌석 제어,좌석 온도 제어,시트 온도 이 단계로 조절해 줘.
215,차선 제어,차선 변경,왼쪽으로 차선 변경,왼쪽 차선에서 다녀.
216,비상 제어,보험사 연락,자동 보험사 연락,자동으로 보험사와 전화 연결되게 설정 할래.
217,차량 제어,운전 제어,일자 추월,앞 차보다 앞질러가자.
218,비상 제어,보험사 연락,자동 보험사 연락,보험 처리가 가능한지 확인 해.
219,차선 제어,차선 변경,오른쪽으로 차선 변경,오른쪽 차선으로 바꿔야 해.
220,차량 제어,운전 제어,일자 추월,전방 차량을 추월해보자.
221,차량 제어,도어 제어,전체 차문 닫기,탑승 후 전체 차 문 닫아.
222,차량 제어,속도 제어,주행 속도 세팅,내가 평소 자주 하는 주행 속도로 세팅해.
223,차량 제어,긴급 차량,에스오에스차량 양보,구급차 지나가게 길 내 줘.
224,주행 정보,주행 기록,자율 주행 주행 기록,자율 주행으로 간 곳들 보여 줄래?
225,비상 제어,보험사 연락,자동 보험사 연락,보험사에 전화할 때는 차량 통화 모드로 전환해 줘.
226,비상 제어,보험사 연락,자동 보험사 연락,사고 나고 내가 말이 없어도 보험사에 자동으로 전화 해.
227,차량 제어,도어 제어,전체 차문 열기,위급 상황이야 전체 차문 다 열어 줘.
228,차량 제어,공조 제어,히터 제어,조수석만 놔두고 히터 다 꺼 줄래?
229,차선 제어,차선 변경,오른쪽으로 차선 변경,오른쪽으로 차선 하나 옆으로 가자.
230,차선 제어,차선 변경,차선 변경,렉카 오니까 일 차로로 차선 변경 시작.
231,차선 제어,갓길 이동 정차,갓길 이동 명령,지금 바로 앞 갓길에 차 세워.
232,차량 제어,긴급 차량,에스오에스차량 양보,뒤에 앰뷸런스에 길 양보하자.
233,차선 제어,차선 변경,차선 변경,반대쪽 차선으로 이동해 줘.
234,차량 제어,좌석 제어,좌석 통풍 켜기,앞 좌석들만 통풍기 켜 봐.
235,비상 제어,차량 비상 정지,비상 정지 모드 켜기,이 신호 지나고 비상 정지 기능 쓰고 싶어.
236,차량 제어,좌석 제어,좌석 온도 내리기,앞 좌석 두 개 온도를 낮게 해 줘.
237,차량 제어,운전 제어,일자 따라 가기,내 앞에 있는 차 계속 따라 가.
238,차량 제어,긴급 차량,에스오에스차량 양보,구급차 진행 통로 확보해 줘.
239,주행 정보,속도 확인,자율 주행 속도 확인,자율 주행 속도 얼마야?
240,주행 정보,주행 기록,자율 주행 주행 기록,저번 달 자율 주행 기록표를 볼래.
241,비상 제어,보험사 연락,자동 보험사 연락,비상 상황에 자동으로 보험사에 연락.
242,차량 제어,도어 제어,전체 차문 닫기,지금 안 닫힌 문 있으면 다시 닫고 잠궈 줘.
243,차량 제어,도어 제어,뒷자리 차문 열기,뒷자리 차 문 잠금 해제하고 문 열어 줘.
244,차량 제어,좌석 제어,좌석 온도 올리기,밖에 추우니까 좌석 시트 따뜻하게 해 줘.
245,차선 제어,갓길 이동 정차,갓길 이동 명령,갓길로 차량 이동 원함.
246,차량 제어,운전 제어,일자 추월,앞에 있는 차 패스해 줘.
247,차량 제어,좌석 제어,좌석 통풍 끄기,좌석 통풍 시스템 종료해.
248,비상 제어,보험사 연락,자동 보험사 연락,보험사에 연락해서 대략적인 과실비율을 산정해달라고 요청해 줘.
